{"schema_version":"1.0.0","case_id":"HK-09880-2026","market":"HK","ticker":"09880.HK","company":"深圳市优必选科技股份有限公司","status":"research_complete","as_of":"2026-08-23","golden_case":false,"archetypes":["humanoid_OEM","commercialization_acceleration","loss_making_hypergrowth","gross_margin_inflection","cash_burn_and_dilution_risk","event_ready"],"dominant_variable":"humanoid_revenue_and_gross_profit_scale_to_operating_cash_breakeven_vs_valuation","value_driver_chain":["humanoid_orders","deliveries","recognized_revenue","gross_margin","opex_and_R&D","operating_loss","cash_burn","financing_dilution","valuation"],"decision_state":{"business_thesis":"strong_commercialization_evidence_but_unprofitable","stock_attractiveness":"watch_event_ready","trade_state":"confirmation_ahead_of_material_earnings_event","action":"watch_20260828","kill_criteria":["humanoid_growth_decelerates_sharply","gross_margin_deteriorates_with_scale","cash_burn_or_dilution_worsens","customer_or_receivable_quality_deteriorates"]},"evidence_summary":{"primary_sources":3,"inference_count":3,"unknowns":["2026H1_humanoid_revenue_and_margin","cash_burn_and_runway","current_order_customer_concentration","2026_guidance"]},"lessons":[{"status":"candidate","principle":"For loss-making humanoid OEMs, recognized robot revenue and gross-margin scaling are stronger evidence than shipment headlines, but the final bridge must still reach cash burn and financing dilution.","scope":"loss_making_hardware_hypergrowth"}]}