{"schema_version":"1.0.0","case_id":"CN_A-002520-2026","market":"CN_A","ticker":"002520.SZ","company":"浙江日发精密机械股份有限公司","status":"research_complete","as_of":"2026-08-23","golden_case":false,"archetypes":["machine_tool_capability","robot_capex_equipment_adjacency","loss_making","audit_quality_risk","concept_mapping_risk"],"dominant_variable":"core_profitability_and_audit_recovery_before_robot_order_option","value_driver_chain":["audit_and_control_quality","core_orders","recurring_profitability","robot_related_machine_orders","cash_conversion","valuation"],"decision_state":{"business_thesis":"robot_application_capability_not_investable_thesis","stock_attractiveness":"avoid","trade_state":"distressed_reunderwrite","action":"avoid","kill_criteria":["qualified_audit_or_control_issues_persist","core_business_remains_loss_making","robot_related_orders_remain_unverified"]},"evidence_summary":{"primary_sources":3,"inference_count":2,"unknowns":["robot_related_machine_orders","robot_revenue","audit_remediation_timing","normalized_earnings_power"]},"lessons":[{"status":"candidate","principle":"Supplying equipment that can manufacture a robot component is a different economic layer from supplying the component itself and should not inherit the same BOM narrative.","scope":"capital_equipment_theme_mapping"}]}