{"schema_version":"1.0.0","case_id":"CN_A-002979-2026","market":"CN_A","ticker":"002979.SZ","company":"深圳市雷赛智能控制股份有限公司","status":"research_complete","as_of":"2026-08-23","golden_case":false,"archetypes":["robotics_core_components","execution_platform","shipment_acceleration","capacity_scale_up","valuation_expectation_risk"],"dominant_variable":"robot_volume_and_content_growth_with_margin_and_cash_conversion","value_driver_chain":["robot_customer_breadth","design_ins","frameless_motor_joint_hand_shipments","capacity_utilization","revenue_mix","gross_margin","gaap_earnings","cfo_fcf","eps_revision","valuation"],"decision_state":{"business_thesis":"strong_positive","stock_attractiveness":"watch_to_start_small_review","trade_state":"confirmation","action":"watch_pending_h1_actual","kill_criteria":["multi_customer_robot_order_or_shipment_deterioration","gross_margin_erodes_despite_volume","capacity_expansion_without_utilization_or_cash_conversion","earnings_revision_deteriorates_while_valuation_remains_high"]},"evidence_summary":{"primary_sources":3,"inference_count":3,"unknowns":["standalone_robot_revenue_and_margin","current_customer_concentration","direct_TianGong_supply_not_established","2026H1_actual_full_cash_flow_and_balance_sheet_pending"]},"lessons":[{"status":"candidate","principle":"For component suppliers, broad multi-customer shipment evidence is stronger than a single famous-BOM association when evaluating scalable industry exposure.","scope":"robotics_component_suppliers"}]}