{"schema_version":"1.0.0","case_id":"CN_A-688017-2026","market":"CN_A","ticker":"688017.SH","company":"苏州绿的谐波传动科技股份有限公司","status":"research_complete","as_of":"2026-08-23","golden_case":false,"archetypes":["humanoid_reducer_leader","high_quality_high_expectations","architecture_competition","multiple_compression_risk"],"dominant_variable":"humanoid_unit_and_content_growth_vs_extreme_price_implied_expectations","value_driver_chain":["humanoid_units","harmonic_content_per_robot","customer_share","reducer_and_actuator_volume","revenue","margin","cash_conversion","net_profit","multiple","shareholder_return"],"decision_state":{"business_thesis":"strong","stock_attractiveness":"unattractive_at_current_expectations","trade_state":"confirmation_harvest_reunderwrite","action":"watch_avoid_chasing","kill_criteria":["major_customers_reduce_harmonic_content","revenue_growth_decelerates_before_scale","margin_or_cash_conversion_deteriorates","valuation_hurdle_remains_disconnected_from_evidenced_growth"]},"evidence_summary":{"primary_sources":4,"inference_count":3,"unknowns":["current_humanoid_revenue_share","customer_concentration_and_unit_economics","current_TianGong_joint_level_supplier_split","2026H1_full_financials"]},"lessons":[{"status":"candidate","principle":"A high-quality industry winner can still be an unattractive security when price-implied growth requires extraordinary execution and durable premium multiples.","scope":"high_expectation_growth_equities"}]}