{"schema_version":"1.0.0","case_id":"CN_A-600580-2026","market":"CN_A","ticker":"600580.SH","company":"卧龙电气驱动集团股份有限公司","status":"research_complete","as_of":"2026-08-23","golden_case":false,"archetypes":["industrial_motor_platform","robotics_motor_option","joint_module_option","liquid_cooling_capability","narrative_attribution_risk"],"dominant_variable":"robot_product_commercial_revenue_and_margin_vs_large_legacy_motor_base","value_driver_chain":["robot_customer_cooperation","design_ins","batch_orders","robot_revenue","margin","group_eps_cfo","valuation"],"decision_state":{"business_thesis":"capability_real_commercial_materiality_unproven","stock_attractiveness":"watch","trade_state":"early_option_validation","action":"watch","kill_criteria":["robot_cooperation_fails_to_generate_batch_revenue","legacy_earnings_weakens_while_new_business_spend_rises","liquid_cooling_remains_r_and_d_only","valuation_relies_on_false_affiliate_narratives"]},"evidence_summary":{"primary_sources":4,"inference_count":2,"unknowns":["robot_revenue_margin_orders","named_current_robot_program_content","liquid_cooling_customer_deliveries","customer_concentration"]},"lessons":[{"status":"candidate","principle":"Capability evidence and named cooperation are intermediate stages; batch revenue and economic materiality remain separate gates.","scope":"industrial_companies_entering_robotics"}]}