{"schema_version":"1.0.0","case_id":"CN_A-688322-2026","market":"CN_A","ticker":"688322.SH","company":"奥比中光科技集团股份有限公司","status":"research_complete","as_of":"2026-08-23","golden_case":false,"archetypes":["robotics_vision_platform","technology_leader","r_and_d_intensity","commercialization_lag","extreme_valuation"],"dominant_variable":"robot_vision_revenue_reacceleration_and_r_and_d_operating_leverage_vs_valuation","value_driver_chain":["robot_design_wins","unit_shipments_and_asp","robot_revenue","gross_margin","r_and_d_leverage","operating_profit","cfo","eps_revision","multiple"],"decision_state":{"business_thesis":"technology_strong_financial_conversion_currently_weak","stock_attractiveness":"avoid_watch","trade_state":"reunderwrite_after_growth_slowdown","action":"avoid_new_entry_watch_evidence","kill_criteria":["robot_wins_fail_to_reaccelerate_revenue","persistent_high_r_and_d_without_operating_leverage","weak_cash_conversion","high_multiple_with_falling_estimates"]},"evidence_summary":{"primary_sources":3,"inference_count":3,"unknowns":["current_TianGong_camera_vendor_and_count","robot_segment_revenue_margin","current_customer_concentration","forward_consensus_expectations"]},"lessons":[{"status":"candidate","principle":"Named technology design-ins do not justify a growth multiple unless they convert into recognized revenue, operating leverage and cash flow.","scope":"sensor_and_platform_technology_suppliers"}]}