{"schema_version":"1.0.0","case_id":"CN_A-002600-2026","market":"CN_A","ticker":"002600.SZ","company":"广东领益智造股份有限公司","status":"research_complete","as_of":"2026-08-23","golden_case":false,"archetypes":["platform_manufacturing","ai_liquid_cooling","humanoid_robotics_supply_chain","content_value_expansion","large_base_dilution"],"dominant_variable":"multi_client_ai_robot_content_value_and_margin_conversion_vs_group_scale","value_driver_chain":["ai_and_robot_customer_programs","design_ins","content_value_per_system","batch_volume","revenue_mix","gross_margin","operating_profit","working_capital","cfo_fcf","eps_revision","valuation"],"decision_state":{"business_thesis":"positive_but_earnings_conversion_pending","stock_attractiveness":"watch_event_ready","trade_state":"confirmation_reunderwrite","action":"watch_no_default_new_capital","kill_criteria":["multi_quarter_margin_and_earnings_deterioration_without_new_business_operating_leverage","new_business_remains_low_value_assembly_and_immaterial_to_profit","material_ai_thermal_or_robot_customer_design_loss","capex_or_working_capital_rises_without_cash_conversion"]},"evidence_summary":{"primary_sources":4,"inference_count":4,"unknowns":["standalone_ai_liquid_cooling_revenue_margin_and_backlog","robotics_revenue_margin_and_customer_concentration","TianGong_current_liquid_cooling_component_supplier_split","H1_2026_full_financial_reunderwrite_pending"]},"lessons":[{"status":"candidate","principle":"A large manufacturing platform can reduce single-customer and technical-route risk while simultaneously diluting EPS sensitivity to a single hot theme.","scope":"large diversified platform suppliers"}]}