{"schema_version":"1.0.0","case_id":"CN_A-002536-2026","market":"CN_A","ticker":"002536.SZ","company":"飞龙汽车部件股份有限公司","status":"research_complete","as_of":"2026-08-23","golden_case":false,"archetypes":["liquid_cooling_real_orders","profit_margin_deterioration","cash_conversion_deterioration","robot_application_adjacency","valuation_risk"],"dominant_variable":"liquid_cooling_order_to_revenue_margin_cash_conversion","value_driver_chain":["liquid_cooling_orders","deliveries","recognized_revenue","gross_margin","operating_profit","cfo","eps","valuation"],"decision_state":{"business_thesis":"liquid_cooling_commercialization_real_economics_weak","stock_attractiveness":"avoid_watch","trade_state":"order_confirmation_financial_deterioration","action":"avoid","kill_criteria":["margin_fails_to_recover","profit_decline_persists","cfo_remains_weak","robot_liquid_cooling_claims_remain_unverified"]},"evidence_summary":{"primary_sources":2,"inference_count":3,"unknowns":["liquid_cooling_revenue_and_margin","robot_liquid_cooling_customer_design_in","order_cancellation_and_conversion_timing","customer_concentration"]},"lessons":[{"status":"candidate","principle":"Real liquid-cooling orders can coexist with falling margins, profit and cash flow; order growth is not sufficient evidence of shareholder economics.","scope":"thermal_management_suppliers"}]}