{"schema_version":"1.0.0","case_id":"CN_A-002747-2026","market":"CN_A","ticker":"002747.SZ","company":"南京埃斯顿自动化股份有限公司","status":"research_complete","as_of":"2026-08-23","golden_case":false,"archetypes":["industrial_robot_leader","turnaround","humanoid_option","nonrecurring_profit_noise","valuation_risk"],"dominant_variable":"recurring_industrial_robot_profitability_plus_humanoid_commercialization_vs_valuation","value_driver_chain":["industrial_robot_shipments","recurring_margin","deducted_profit","cfo","humanoid_validation","humanoid_orders","group_eps","valuation"],"decision_state":{"business_thesis":"industrial_robot_turnaround_real_humanoid_option_early","stock_attractiveness":"watch_avoid_chasing","trade_state":"turnaround_confirmation_with_option","action":"watch","kill_criteria":["deducted_profit_and_cash_do_not_improve","humanoid_remains_nonmaterial_validation","headline_profit_relies_on_nonrecurring_gains","valuation_remains_extreme_without_core_earnings"]},"evidence_summary":{"primary_sources":3,"inference_count":3,"unknowns":["humanoid_revenue_orders_and_margin","recurring_2026H1_operating_bridge","customer_concentration","forward_consensus"]},"lessons":[{"status":"candidate","principle":"Headline turnaround profit must be decomposed into recurring operating improvement and nonrecurring fair-value or disposal gains before applying a growth multiple.","scope":"turnarounds"}]}