{"schema_version":"1.0.0","case_id":"CN_A-301252-2026","market":"CN_A","ticker":"301252.SZ","company":"浙江同星科技股份有限公司","status":"research_complete","as_of":"2026-08-23","golden_case":false,"archetypes":["robotics_precision_components","robotics_thermal_management","small_batch_to_scale","margin_conversion_risk","working_capital_risk"],"dominant_variable":"robot_design_in_to_batch_revenue_and_margin_cash_conversion","value_driver_chain":["robot_design_ins","validation","small_batch","stable_batch_volume","robot_revenue_mix","gross_margin","working_capital","cfo_fcf","eps_revision","valuation"],"decision_state":{"business_thesis":"promising_industry_validation_financial_conversion_lagging","stock_attractiveness":"watch_thesis_building","trade_state":"early_confirmation","action":"watch_no_default_new_capital","kill_criteria":["robot_thermal_programs_stall_at_small_batch","gross_margin_continues_declining","cfo_remains_structurally_negative","valuation_expands_without_eps_revision"]},"evidence_summary":{"primary_sources":3,"inference_count":3,"unknowns":["named_robot_customers","standalone_robot_revenue_margin_and_backlog","robot_thermal_module_ASP_and_content_value","customer_concentration"]},"lessons":[{"status":"candidate","principle":"A design-in or small-batch milestone is economically different from material revenue and must be tracked as a conversion stage.","scope":"emerging component suppliers"}]}