{"schema_version":"1.0.0","case_id":"CN_A-002472-2026","market":"CN_A","ticker":"002472.SZ","company":"浙江双环传动机械股份有限公司","status":"research_complete","as_of":"2026-08-23","golden_case":false,"archetypes":["profitable_auto_supplier","rv_reducer_option","subsidiary_value_capture","spin_off_dilution","value_challenger"],"dominant_variable":"huandong_robotics_profit_contribution_adjusted_for_parent_ownership_and_dilution","value_driver_chain":["auto_gear_cash_engine","huandong_RV_demand","humanoid_design_ins","batch_volume","subsidiary_profit","parent_ownership","group_eps_cfo","valuation"],"decision_state":{"business_thesis":"positive_base_with_robot_option","stock_attractiveness":"watch_value_challenger","trade_state":"early_option_confirmation","action":"watch","kill_criteria":["humanoid_programs_do_not_reach_batch_revenue","subsidiary_dilution_offsets_value_capture","auto_cash_engine_weakens","pure_robot_rerating_precedes_eps_contribution"]},"evidence_summary":{"primary_sources":4,"inference_count":3,"unknowns":["named_humanoid_customers","humanoid_revenue_at_Huandong","post_IPO_parent_economic_ownership","current_TianGong_supply_not_established"]},"lessons":[{"status":"candidate","principle":"When the attractive robotics asset sits inside a listed subsidiary or IPO candidate, value capture must be adjusted for parent ownership and dilution rather than inferred from subsidiary growth alone.","scope":"listed_parent_subsidiary_cases"}]}