{"schema_version":"1.0.0","case_id":"CN_A-002896-2026","market":"CN_A","ticker":"002896.SZ","company":"宁波中大力德智能传动股份有限公司","status":"research_complete","as_of":"2026-08-23","golden_case":false,"archetypes":["precision_transmission","concept_mapping_risk","earnings_deterioration","cash_conversion_deterioration","extreme_valuation"],"dominant_variable":"verified_current_humanoid_batch_economics_vs_price_implied_expectations","value_driver_chain":["verified_robot_design_in","batch_orders","recognized_revenue","margin","cfo","eps","valuation"],"decision_state":{"business_thesis":"core_products_real_humanoid_mapping_unverified","stock_attractiveness":"avoid_watch","trade_state":"evidence_gap_high_expectations","action":"avoid_until_verified","kill_criteria":["no_current_primary_humanoid_design_in_evidence","profit_and_cash_continue_deteriorating","valuation_expands_without_batch_economics"]},"evidence_summary":{"primary_sources":3,"inference_count":2,"unknowns":["current_named_humanoid_customers","humanoid_batch_revenue","robot_segment_margin","order_backlog"]},"lessons":[{"status":"candidate","principle":"A component that can technically be used in humanoids is not evidence that the company is a current humanoid supplier.","scope":"concept_mapping"}]}