{"schema_version":"1.0.0","case_id":"CN_A-601689-2026","market":"CN_A","ticker":"601689.SH","company":"宁波拓普集团股份有限公司","status":"research_complete","as_of":"2026-08-23","golden_case":false,"archetypes":["automotive_cash_engine","robotics_actuator_option","ai_liquid_cooling_option","cross_mechanism_challenger","theme_dilution"],"dominant_variable":"new_robotics_and_ai_cooling_profit_contribution_vs_large_auto_base","value_driver_chain":["auto_base_cash_generation","robot_actuator_programs","ai_liquid_cooling_programs","batch_revenue","incremental_margin","group_eps","cfo_fcf","valuation"],"decision_state":{"business_thesis":"credible_options_on_profitable_base","stock_attractiveness":"watch_challenger","trade_state":"early_new_business_confirmation","action":"watch","kill_criteria":["robot_and_ai_programs_fail_to_become_material","auto_base_cash_generation_structurally_deteriorates","new_field_capex_lacks_returns","theme_multiple_expands_without_earnings"]},"evidence_summary":{"primary_sources":3,"inference_count":3,"unknowns":["standalone_robot_actuator_revenue_margin","standalone_ai_liquid_cooling_revenue_margin","RMB1_5bn_order_composition_and_conversion_timing","2026H1_full_results"]},"lessons":[{"status":"candidate","principle":"When a company participates in two hot themes through separate businesses, do not combine them into one economic order or one causal thesis without segment evidence.","scope":"multi_theme_industrials"}]}